{
  "content_sha256": "7f65577989791b921b9d79d9a4b540c6bcac1230a32f336f839615ee60e0a182",
  "schema_version": 1,
  "record_id": "model-request-fixture-v1",
  "request_id": "model-request-fixture-v1",
  "host_state": {
    "record_id": "host-state-fixture:v1",
    "content_sha256": "aaaaaaaaaaaaaaaaaaaaaaaaaaaaaaaaaaaaaaaaaaaaaaaaaaaaaaaaaaaaaaaa",
    "host_profile_id": "host-profile-fixture:v1",
    "host_genome_sha256": "dddddddddddddddddddddddddddddddddddddddddddddddddddddddddddddddd",
    "as_of": "2026-10-17T11:00:00+00:00"
  },
  "phage_profile_id": "phage-profile-fixture-v1",
  "phage_profile_sha256": "bbbbbbbbbbbbbbbbbbbbbbbbbbbbbbbbbbbbbbbbbbbbbbbbbbbbbbbbbbbbbbbb",
  "requested_targets": [
    "productive_infection"
  ],
  "created_at": "2026-10-17T12:00:00+00:00"
}
